{
 "catalog_version": "1",
 "retailer": "partscat",
 "eval_id": "SE-20260812",
 "captured_at": "2026-08-12T04:40:22.988Z",
 "source": {
  "method": "nav_crawl",
  "base_url": "https://parts.cat.com/en/catcorp",
  "notes": "Browser-eval capture (Akamai blocks server-side). Category tree + PLP tiles read via same-origin fetch; tiles carry \"<PART#>: <title>\". WebSphere/HCL Commerce."
 },
 "facet_provenance": "unknown",
 "nodes": [
  {
   "node_id": "electrical-electronics-batteries",
   "node_name": "Batteries",
   "parent_id": "electrical-electronics",
   "depth": 1,
   "url": "https://parts.cat.com/en/catcorp/category/electrical-electronics-batteries",
   "sku_count": 1349,
   "singular": "battery"
  },
  {
   "node_id": "batteries-battery-components",
   "node_name": "Battery Components",
   "parent_id": "electrical-electronics-batteries",
   "depth": 2,
   "url": "https://parts.cat.com/en/catcorp/category/batteries-battery-components",
   "sku_count": 1076,
   "singular": "battery components"
  },
  {
   "node_id": "batteries-gen-duty",
   "node_name": "General Duty",
   "parent_id": "electrical-electronics-batteries",
   "depth": 2,
   "url": "https://parts.cat.com/en/catcorp/category/batteries-gen-duty",
   "sku_count": 146,
   "singular": "general duty battery"
  },
  {
   "node_id": "batteries-hvy-duty",
   "node_name": "Heavy Duty",
   "parent_id": "electrical-electronics-batteries",
   "depth": 2,
   "url": "https://parts.cat.com/en/catcorp/category/batteries-hvy-duty",
   "sku_count": 26,
   "singular": "heavy duty battery"
  },
  {
   "node_id": "batteries-other",
   "node_name": "Other Batteries",
   "parent_id": "electrical-electronics-batteries",
   "depth": 2,
   "url": "https://parts.cat.com/en/catcorp/category/batteries-other",
   "sku_count": 48,
   "singular": "battery"
  },
  {
   "node_id": "batteries-uninterruptible-power-supply",
   "node_name": "Uninterruptible Power Supply",
   "parent_id": "electrical-electronics-batteries",
   "depth": 2,
   "url": "https://parts.cat.com/en/catcorp/category/batteries-uninterruptible-power-supply",
   "sku_count": 53,
   "singular": "uninterruptible power supply"
  },
  {
   "node_id": "filters-and-fluids-filters",
   "node_name": "Filters",
   "parent_id": "filters-and-fluids",
   "depth": 1,
   "url": "https://parts.cat.com/en/catcorp/category/filters-and-fluids-filters",
   "sku_count": 4608,
   "singular": "filter"
  },
  {
   "node_id": "filters-air-filters",
   "node_name": "Air Filters",
   "parent_id": "filters-and-fluids-filters",
   "depth": 2,
   "url": "https://parts.cat.com/en/catcorp/category/filters-air-filters",
   "sku_count": 1200,
   "singular": "air filter"
  },
  {
   "node_id": "filters-engine-oil-filters-components",
   "node_name": "Engine Oil Filters & Components",
   "parent_id": "filters-and-fluids-filters",
   "depth": 2,
   "url": "https://parts.cat.com/en/catcorp/category/filters-engine-oil-filters-components",
   "sku_count": 914,
   "singular": "engine oil filter"
  },
  {
   "node_id": "filters-fuel-filters-fuel-water-separators",
   "node_name": "Fuel Filters & Fuel Water Separators",
   "parent_id": "filters-and-fluids-filters",
   "depth": 2,
   "url": "https://parts.cat.com/en/catcorp/category/filters-fuel-filters-fuel-water-separators",
   "sku_count": 831,
   "singular": "fuel filter"
  },
  {
   "node_id": "filters-hydraulic-transmission-filters",
   "node_name": "Hydraulic & Transmission Filters",
   "parent_id": "filters-and-fluids-filters",
   "depth": 2,
   "url": "https://parts.cat.com/en/catcorp/category/filters-hydraulic-transmission-filters",
   "sku_count": 663,
   "singular": "hydraulic filter"
  },
  {
   "node_id": "ground-engaging-tools-get",
   "node_name": "Ground Engaging Tools",
   "parent_id": null,
   "depth": 0,
   "url": "https://parts.cat.com/en/catcorp/category/ground-engaging-tools-get",
   "sku_count": 23155,
   "singular": "ground engaging tools"
  },
  {
   "node_id": "get-blade-edges-end-bits",
   "node_name": "Blade Cutting Edges & End Bits",
   "parent_id": "ground-engaging-tools-get",
   "depth": 1,
   "url": "https://parts.cat.com/en/catcorp/category/get-blade-edges-end-bits",
   "sku_count": 1221,
   "singular": "cutting edge"
  },
  {
   "node_id": "get-bucket-base-edges-lips",
   "node_name": "Bucket Base Edges & Lips",
   "parent_id": "ground-engaging-tools-get",
   "depth": 1,
   "url": "https://parts.cat.com/en/catcorp/category/get-bucket-base-edges-lips",
   "sku_count": 3475,
   "singular": "bucket base edge"
  },
  {
   "node_id": "get-bucket-corners-guards",
   "node_name": "Bucket Corners & Corner Guards",
   "parent_id": "ground-engaging-tools-get",
   "depth": 1,
   "url": "https://parts.cat.com/en/catcorp/category/get-bucket-corners-guards",
   "sku_count": 173,
   "singular": "bucket corner"
  },
  {
   "node_id": "get-bucket-cutting-edges-protection",
   "node_name": "Bucket Cutting Edges & Edge Protection",
   "parent_id": "ground-engaging-tools-get",
   "depth": 1,
   "url": "https://parts.cat.com/en/catcorp/category/get-bucket-cutting-edges-protection",
   "sku_count": 3375,
   "singular": "bucket cutting edge"
  },
  {
   "node_id": "get-bucket-teeth-adapter-sys",
   "node_name": "Bucket Teeth & Adapter Systems",
   "parent_id": "ground-engaging-tools-get",
   "depth": 1,
   "url": "https://parts.cat.com/en/catcorp/category/get-bucket-teeth-adapter-sys",
   "sku_count": 2426,
   "singular": "bucket teeth"
  },
  {
   "node_id": "get-compactor-wheel",
   "node_name": "Compactor Wheel Ground Engaging Tools",
   "parent_id": "ground-engaging-tools-get",
   "depth": 1,
   "url": "https://parts.cat.com/en/catcorp/category/get-compactor-wheel",
   "sku_count": 38,
   "singular": "compactor wheel"
  },
  {
   "node_id": "get-grader-bit-systems",
   "node_name": "Grader Bit Systems",
   "parent_id": "ground-engaging-tools-get",
   "depth": 1,
   "url": "https://parts.cat.com/en/catcorp/category/get-grader-bit-systems",
   "sku_count": 193,
   "singular": "grader bit"
  },
  {
   "node_id": "get-cutting-edges-end-bits",
   "node_name": "Grader Cutting Edges & End Bits",
   "parent_id": "ground-engaging-tools-get",
   "depth": 1,
   "url": "https://parts.cat.com/en/catcorp/category/get-cutting-edges-end-bits",
   "sku_count": 652,
   "singular": "grader cutting edge"
  },
  {
   "node_id": "get-hardware-retention",
   "node_name": "Ground Engaging Tool Hardware & Retention",
   "parent_id": "ground-engaging-tools-get",
   "depth": 1,
   "url": "https://parts.cat.com/en/catcorp/category/get-hardware-retention",
   "sku_count": 5443,
   "singular": "get hardware"
  },
  {
   "node_id": "get-paving",
   "node_name": "Paving Ground Engaging Tools",
   "parent_id": "ground-engaging-tools-get",
   "depth": 1,
   "url": "https://parts.cat.com/en/catcorp/category/get-paving",
   "sku_count": 129,
   "singular": "paving tool"
  },
  {
   "node_id": "get-ripper-and-scarifier",
   "node_name": "Ripper & Scarifier Ground Engaging Tools",
   "parent_id": "ground-engaging-tools-get",
   "depth": 1,
   "url": "https://parts.cat.com/en/catcorp/category/get-ripper-and-scarifier",
   "sku_count": 251,
   "singular": "ripper tooth"
  },
  {
   "node_id": "get-rock-drill",
   "node_name": "Rock Drill Ground Engaging Tools",
   "parent_id": "ground-engaging-tools-get",
   "depth": 1,
   "url": "https://parts.cat.com/en/catcorp/category/get-rock-drill",
   "sku_count": 408,
   "singular": "rock drill bit"
  },
  {
   "node_id": "get-scraper",
   "node_name": "Scraper Ground Engaging Tools",
   "parent_id": "ground-engaging-tools-get",
   "depth": 1,
   "url": "https://parts.cat.com/en/catcorp/category/get-scraper",
   "sku_count": 264,
   "singular": "scraper edge"
  },
  {
   "node_id": "get-side-cutters-sidebar",
   "node_name": "Side Cutters & Sidebar Protection",
   "parent_id": "ground-engaging-tools-get",
   "depth": 1,
   "url": "https://parts.cat.com/en/catcorp/category/get-side-cutters-sidebar",
   "sku_count": 347,
   "singular": "side cutter"
  },
  {
   "node_id": "get-wear-plates",
   "node_name": "Wear Plates",
   "parent_id": "ground-engaging-tools-get",
   "depth": 1,
   "url": "https://parts.cat.com/en/catcorp/category/get-wear-plates",
   "sku_count": 4201,
   "singular": "wear plate"
  }
 ],
 "facets": [],
 "sibling_blocklist": [
  [
   "batteries-battery-components",
   "batteries-gen-duty"
  ],
  [
   "batteries-battery-components",
   "batteries-hvy-duty"
  ],
  [
   "batteries-battery-components",
   "batteries-other"
  ],
  [
   "batteries-battery-components",
   "batteries-uninterruptible-power-supply"
  ],
  [
   "batteries-gen-duty",
   "batteries-hvy-duty"
  ],
  [
   "batteries-gen-duty",
   "batteries-other"
  ],
  [
   "batteries-gen-duty",
   "batteries-uninterruptible-power-supply"
  ],
  [
   "batteries-hvy-duty",
   "batteries-other"
  ],
  [
   "batteries-hvy-duty",
   "batteries-uninterruptible-power-supply"
  ],
  [
   "batteries-other",
   "batteries-uninterruptible-power-supply"
  ],
  [
   "filters-air-filters",
   "filters-engine-oil-filters-components"
  ],
  [
   "filters-air-filters",
   "filters-fuel-filters-fuel-water-separators"
  ],
  [
   "filters-air-filters",
   "filters-hydraulic-transmission-filters"
  ],
  [
   "filters-engine-oil-filters-components",
   "filters-fuel-filters-fuel-water-separators"
  ],
  [
   "filters-engine-oil-filters-components",
   "filters-hydraulic-transmission-filters"
  ],
  [
   "filters-fuel-filters-fuel-water-separators",
   "filters-hydraulic-transmission-filters"
  ],
  [
   "get-blade-edges-end-bits",
   "get-bucket-base-edges-lips"
  ],
  [
   "get-blade-edges-end-bits",
   "get-bucket-corners-guards"
  ],
  [
   "get-blade-edges-end-bits",
   "get-bucket-cutting-edges-protection"
  ],
  [
   "get-blade-edges-end-bits",
   "get-bucket-teeth-adapter-sys"
  ],
  [
   "get-blade-edges-end-bits",
   "get-compactor-wheel"
  ],
  [
   "get-blade-edges-end-bits",
   "get-grader-bit-systems"
  ],
  [